,eid,doi,pii,pubmed_id,title,subtype,subtypeDescription,creator,afid,affilname,affiliation_city,affiliation_country,author_count,author_names,author_ids,author_afids,coverDate,coverDisplayDate,publicationName,issn,source_id,eIssn,aggregationType,volume,issueIdentifier,article_number,pageRange,description,authkeywords,citedby_count,openaccess,fund_acr,fund_no,fund_sponsor,paper_key,place_holder,month_year
65,2-s2.0-19944432264,10.1021/jm049494r,,15658853,Aminoimidazolylmethyluracil analogues as potent inhibitors of thymidine phosphorylase and their bioreductive nitroimidazolyl prodrugs,ar,Article,Reigan P.,60004219;60003771,AstraZeneca;The University of Manchester,Cambridge;Manchester,United Kingdom;United Kingdom,13,"['Reigan, Philip', 'Edwards, Philip N.', 'Gbaj, Abdul', 'Cole, Christian', 'Barry, Simon T.', 'Page, Ken M.', 'Ashton, Susan E.', 'Luke, Richard W.A.', 'Douglas, Kenneth T.', 'Stratford, Ian J.', 'Jaffar, Mohammed', 'Bryce, Richard A.', 'Freeman, Sally']","['8861836800', '8760689000', '8760689100', '7202468472', '7102878789', '7102902119', '7005705242', '7102188780', '7101692635', '7004547474', '7006611420', '7006481959', '16143095900']",60003771;60003771;60003771;60003771;60004219;60004219;60004219;60004219;60003771;60003771;60003771;60003771;60003771,2005-01-27,27 January 2005,Journal of Medicinal Chemistry,00222623,23041,,Journal,48,2,,392-402,"Thymidine phosphorylase (TP) is an important target enzyme for cancer chemotherapy because it is expressed at high levels in the hypoxic regions of many tumors and inhibitors of TP have been shown in animal model studies to inhibit angiogenesis and metastasis, and to promote tumor cell apoptosis. The 5-halo-6-[(2′-aminoimidazol-1′-yl)methyl]uracils (3, X = Cl, Br) are very potent inhibitors of E. coli and human TP with IC50 values of ∼20 nM when the enzyme concentration is ∼40 nM. Their 4′-aminoimidazol-1′-yl analogues (4, X = Cl, Br) are >350-fold less active with IC50 values of ∼7 μM. The 5-unsubstituted analogues (3 and 4, X = H) were both less active than their 5-halo derivatives. Determination of pKa values and molecular modeling studies of these compounds in the active site of human TP was used to rationalize their activities. The finding that 3, X = Br has a poor pharmacokinetic (PK) profile in mice, coupled with the desire for tumor selectivity, led us to design prodrugs. The corresponding 2′-nitroimidazol-1′-ylmethyluracils (5, X = Cl, Br) are >1000-fold less active (IC50 22-24 μM) than their 2′-amino analogues and are reduced to the 2′-amino inhibitors (3, X = Cl, Br) by xanthine oxidase (XO). As XO is also highly expressed in many tumors, the 2′-nitro prodrugs have the potential to selectively deliver the potent 2′-aminoimidazol-1′-yl TP inhibitors into hypoxic solid tumors.",,50,0,,undefined,,papers by authors,0.5,2005-01-01
66,2-s2.0-24944490378,10.1039/b504001a,,16096671,"Analytical chemistry of synthetic routes to psychoactive tryptamines Part III. Characterisation of the Speeter and Anthony route to N,N-dialkylated tryptamines using CI-IT-MS-MS",ar,Article,Brandt S.D.,60099298;60003771,Department of Chemical Engineering and Analytical Science;The University of Manchester,Manchester;Manchester,United Kingdom;United Kingdom,4,"['Brandt, Simon D.', 'Freeman, Sally', 'Fleet, Ian A.', 'Alder, John F.']","['7202305906', '16143095900', '7004340158', '7004345963']",60099298;60003771;60099298;60099298,2005-01-01,September 2005,Analyst,00032654,23909,,Journal,130,9,,1258-1262,"Twelve symmetrically and 13 asymmetrically N,N-disubstituted glyoxalylamide precursors and their corresponding tryptamine derivatives have been characterised by gas chromatography low-pressure chemical ionisation ion trap tandem mass spectrometry (CI-IT-MS-MS) with internal (in situ) ionisation using methanol as the chemical ionisation reagent. Mass spectral differences and similarities between the investigated compounds are discussed and put into context with previous investigations. In tryptamines the formation of [CH 2=N+R2R3] iminium ions after β-cleavage appears to be the dominating process. Dissociation of the protonated molecule into [3-vinylindole]+ for example, appears to be a minor pathway when compared with electrospray triple quadrupole tandem mass spectrometry (ESI-TQ-MS-MS) where this ion transition was found to be of distinctive importance. CI-IT-MS-MS is also found to enable the differentiation between most isomeric derivatives studied. © The Royal Society of Chemistry 2005.",,10,0,,undefined,,papers by authors,1.0,2005-01-01
67,2-s2.0-15244355527,10.1039/b413014f,,15724162,"Analytical chemistry of synthetic routes to psychoactive tryptamines Part II. Characterisation of the Speeter and Anthony synthetic route to N,N-dialkylated tryptamines using GC-EI-ITMS, ESI-TQ-MS-MS and NMR",ar,Article,Brandt S.D.,60003771,The University of Manchester,Manchester,United Kingdom,5,"['Brandt, Simon D.', 'Freeman, Sally', 'Fleet, Ian A.', 'McGagh, Peter', 'Alder, John F.']","['7202305906', '16143095900', '7004340158', '6508123118', '7004345963']",60003771;60003771;60003771;60003771;60003771,2005-01-01,March 2005,Analyst,00032654,23909,,Journal,130,3,,330-344,"The degree of alkylation of the side chain nitrogen in tryptamines is one important factor that affects psychoactivity. The method of Speeter and Anthony is considered to be one of the most important synthetic preparative methods. The final step in this reaction is based on the reduction of a (substituted) indole-3-yl-glyoxalylamide to the desired tryptamine with metal hydride. Twelve symmetrically and 13 asymmetrically N,N-disubstituted glyoxalylamides and their corresponding tryptamine derivatives have been synthesised and characterised by gas chromatography EI-ion trap mass spectrometry, electrospray-triple quadrupole-tandem mass spectrometry and NMR spectroscopy. Mass spectral and NMR similarities and differences between the investigated compounds are discussed. A solvent dependency is observed that has to be taken into consideration for the unambiguous assignment of 1H- and 13C-NMR chemical shifts. The 1H-NMR study demonstrated that one can evaluate the rotamer populations of the asymmetrical glyoxalylamides. In a forensic or clinical scenario where single or multiple reaction monitoring approaches are contemplated, the appropriate ion transitions of choice may then focus on the two main fragmentations, namely β-cleavage ([M+H]+ → CH2N+R2R3) and/or α-cleavage ([M+H]+ → [3-vinylindole]+), respectively. The synthesis, NMR and MS analytical data presented provide the forensic analyst and clinical biochemist with a detailed and self-consistent body of information and mechanisms for the spectral identification of the more likely psychoactive tryptamines that may be met. © The Royal Society of Chemistry 2005.",,40,0,,undefined,,papers by authors,1.5,2005-01-01
68,2-s2.0-7944239256,10.1016/j.jpba.2004.08.022,S0731708504004030,15533659,An analytical perspective on favoured synthetic routes to the psychoactive tryptamines,re,Review,Brandt S.,60003771,The University of Manchester,Manchester,United Kingdom,5,"['Brandt, Simon D.', 'Freeman, Sally', 'McGagh, Peter', 'Abdul-Halim, Norliza', 'Alder, John F.']","['7202305906', '16143095900', '6508123118', '6504299634', '7004345963']",60003771;60003771;60003771;60003771;60003771,2004-11-19,19 November 2004,Journal of Pharmaceutical and Biomedical Analysis,07317085,23061,,Journal,36,4,,675-691,"Many tryptamine derivatives are known to induce altered states of consciousness and are increasingly of interest in forensic and neurobiological studies. The analytical chemistry of certain synthetic routes to the tryptamines is discussed and likely side products and impurities identified, where literature reports are available. Recent examples from the authors' laboratory are presented to highlight future prospects and implications for analytical procedures. The aim of this review is to provide the analytical chemist with the foundation chemistry and some analytical targets to be able to undertake direct characterisation of products and intermediates. These might become available from interdiction of clandestine operations in a forensic environment or during the synthesis of the tryptamines for investigative neurobiological and clinical procedures. © 2004 Elsevier B.V. All rights reserved.",Analytical chemistry | Forensic studies | Neurobiological procedures | Tryptamines,19,0,DIAS,undefined,Division of Institution and Award Support,papers by authors,0.0,2004-11-01
69,2-s2.0-5344249376,10.1016/j.bmcl.2004.08.036,S0960894X04010443,15454205,Synthesis and enzymatic evaluation of xanthine oxidase-activated prodrugs based on inhibitors of thymidine phosphorylase,ar,Article,Reigan P.,60003771,The University of Manchester,Manchester,United Kingdom,6,"['Reigan, Philip', 'Gbaj, Abdul', 'Chinje, Edwin', 'Stratford, Ian J.', 'Douglas, Kenneth T.', 'Freeman, Sally']","['8861836800', '8760689100', '6701735587', '7004547474', '7101692635', '16143095900']",60003771;60003771;60003771;60003771;60003771;60003771,2004-11-01,1 November 2004,Bioorganic and Medicinal Chemistry Letters,0960894X,25788,,Journal,14,21,,5247-5250,A series of xanthine oxidase-activated prodrugs of known inhibitors of thymidine phosphorylase are described. These prodrugs were oxidised by xanthine oxidase at C-2 and/or C-4 of the uracil ring to generate the desired TP inhibitor. The scheme shows the prodrug of TPI. A series of xanthine oxidase-activated prodrugs of known inhibitors of thymidine phosphorylase has been designed and synthesised to introduce tumour selectivity. These prodrugs were oxidised by xanthine oxidase at C-2 and/or C-4 of the uracil ring to generate the desired TP inhibitor. © 2004 Elsevier Ltd. All rights reserved.,Inhibitor | Prodrug | Thymidine phosphorylase | Xanthine oxidase,22,0,MRC,undefined,Medical Research Council,papers by authors,0.5,2004-11-01
70,2-s2.0-8844246411,10.1039/b407239c,,15508033,"Analytical chemistry of synthetic routes to psychoactive tryptamines: Part I. Characterisation of the Speeter and Anthony synthetic route to 5-methoxy-N,N-diisopropyltryptamine using ESI-MS-MS and ESI-TOF-MS",ar,Article,Brandt S.D.,60003771,The University of Manchester,Manchester,United Kingdom,5,"['Brandt, Simon D.', 'Freeman, Sally', 'Fleet, Ian A.', 'McGagh, Peter', 'Alder, John F.']","['7202305906', '16143095900', '7004340158', '6508123118', '7004345963']",60003771;60003771;60003771;60003771;60003771,2004-01-01,November 2004,Analyst,00032654,23909,,Journal,129,11,,1047-1057,"5-Methoxy-N,N-diisopropyltryptamine (5-MeO-DIPT), a new psychoactive tryptamine derivative, has been synthesised by the Speeter and Anthony procedure. This synthetic route was characterised by ESI-MS-MS, ESI-TOF-MS and NMR. Side products have been identified as 3-(2-N,N-diisopropylamino-ethyl)-1H- indol-5-ol (5), 2-N,N-diisopropylamino-1-(5-methoxy-1H-indol-3-yl)-ethanol (6), 2-(5-methoxy-1H-indol-3-yl)-ethanol (7) and 2-N,N-diisopropylamino-1-(5-methoxy- 1H-indol-3-yl)-ethanone (8).",,19,0,,undefined,,papers by authors,0.0,2004-01-01
71,2-s2.0-0141433393,10.1016/j.bmcl.2003.08.010,S0960894X03008382,14552762,Identification of a novel class of inhibitor of human and Escherichia coli thymidine phosphorylase by in silico screening,ar,Article,McNally V.A.,60003771,The University of Manchester,Manchester,United Kingdom,7,"['McNally, V. A.', 'Gbaj, A.', 'Douglas, K. T.', 'Stratford, I. J.', 'Jaffar, M.', 'Freeman, S.', 'Bryce, R. A.']","['55879115200', '8760689100', '7101692635', '7004547474', '7006611420', '16143095900', '7006481959']",60003771;60003771;60003771;60003771;60003771;60003771;60003771,2003-11-03,3 November 2003,Bioorganic and Medicinal Chemistry Letters,0960894X,25788,,Journal,13,21,,3705-3709,"Structure-based computational screening of the National Cancer Institute database of anticancer compounds identified novel non-nucleobase-derived inhibitors of human thymidine phosphorylase as candidates for lead optimization. The hierarchical in silico screening strategy predicted potentially strong low molecular weight ligands exhibiting a range of molecular scaffolds. Of the thirteen ligands assayed for activity, all displayed inhibitory activity against Escherichia coli thymidine phosphorylase. One compound, hydrazine carboxamide 2-[(1-methyl-2,5-dioxo-4-pentyl-4-imidazolidinyl)methylene], was found to inhibit E. coli thymidine phosphorylase with an IC50 value of 20 μM and an IC50 value of 77 μM against human thymidine phosphorylase. As this hydantoin derivative lacks the undesirable ionic sites of existing tight-binding nucleobase-derived inhibitors, such as 5-chloro-6-[(2-iminopyrrolidin-1-yl)methyl]uracil hydrochloride, it provides an opportunity for the design of potent thymidine phosphorylase inhibitors with improved pharmacokinetic properties. © 2003 Elsevier Ltd. All rights reserved.",,19,0,MRC,undefined,Medical Research Council,papers by authors,0.0,2003-11-01
72,2-s2.0-0037448395,10.1021/jm020964w,,12519058,Potential tumor-selective nitroimidazolylmethyluracil prodrug derivatives: Inhibitors of the angiogenic enzyme thymidine phosphorylase,ar,Article,Cole C.,60003771,The University of Manchester,Manchester,United Kingdom,8,"['Cole, Christian', 'Reigan, Philip', 'Gbaj, Abdul', 'Edwards, Philip N.', 'Douglas, Kenneth T.', 'Stratford, Ian J.', 'Freeman, Sally', 'Jaffar, Mohammed']","['7202468472', '8861836800', '8760689100', '8760689000', '7101692635', '7004547474', '16143095900', '7006611420']",60003771;60003771;60003771;60003771;60003771;60003771;60003771;60003771,2003-01-16,16 January 2003,Journal of Medicinal Chemistry,00222623,23041,,Journal,46,2,,207-209,"Thymidine phosphorylase (TP) is an angiogenic growth factor and a target for anticancer drug design. Molecular modeling suggested that 2′-aminoimidazolylmethyluracils would be potent inhibitors of TP. The novel 5-halo-2-amino-imidazolylmethyluracils (4b/4c) were very potent inhibitors of E. coli TP (IC50 ∼ 20 nM). Contrastingly, the corresponding 2′-nitroimidazolylmethyluracil (as bioreductively activated) prodrugs (3b/3c) were 1000-fold less active (IC50 22-24 μM. This approach may be used to selectively deliver TP inhibitors into hypoxic regions of solid tumors where TP is overexpressed.",,52,0,,undefined,,papers by authors,0.0,2003-01-01
73,2-s2.0-0037046867,10.1016/S0223-5234(02)01382-X,S022352340201382X,12126772,Arylethylamine psychotropic recreational drugs: A chemical perspective,no,Note,Freeman S.,60003771,The University of Manchester,Manchester,United Kingdom,2,"['Freeman, Sally', 'Alder, John F.']","['16143095900', '7004345963']",60003771;60003771,2002-07-09,9 July 2002,European Journal of Medicinal Chemistry,02235234,17464,,Journal,37,7,,527-539,"The arylethylamines substituted in the aryl ring, side-chain carbons and on the terminal amine, comprise a large number of human mood and behaviour altering chemicals. Some of these psychotropic drugs have been used since pre-history, but in many states are proscribed and are consequently subject to clandestine synthesis and illegal traffic world-wide in the forms particularly of amphetamines and to a lesser extent tryptamines. The chemistry employed in the synthesis of these compounds is dictated often by the available precursors and relies usually on relatively simple, unsophisticated conversion reactions to a suitable product. The internet web sites and documentation of the recreational drug culture have been studied alongside the professional scientific and regulatory literature. The review demonstrates the great complexity of the chemistry and neuro-pharmacology of these chemicals and the challenge faced by legislative bodies to control their traffic and use for the sake of social welfare. © 2002 Published by Éditions scientifiques et médicales Elsevier SAS.",Amphetamines | Clandestine synthesis | Phenethylamines | Psychotropic | Tryptamines,49,0,,undefined,,papers by authors,0.5,2002-07-01
74,2-s2.0-0037075786,10.1021/jm011056m,,11882005,Stereochemistry at phosphorus of the reaction catalyzed by myo-inositol monophosphatase,ar,Article,Fauroux C.,60033125;60025225;60003771,University of Leicester;University of Southampton;The University of Manchester,Leicester;Southampton;Manchester,United Kingdom;United Kingdom;United Kingdom,6,"['Fauroux, Christine M.J.', 'Lee, Michael', 'Cullis, Paul M.', 'Douglas, Kenneth T.', 'Gore, Michael G.', 'Freeman, Sally']","['6507753070', '7409118844', '7101856305', '7101692635', '57203612453', '16143095900']",60003771;60033125;60033125;60003771;60025225;60003771,2002-03-14,14 March 2002,Journal of Medicinal Chemistry,00222623,23041,,Journal,45,6,,1363-1373,"myo-Inositol monophosphatase (IMPase), the proposed target for lithium therapy for manic depression, is an important enzyme in the biosynthesis of second messengers. Earlier studies have shown that the IMPase-catalyzed hydrolysis of myo-inositol monophosphates to inorganic phosphate and myo-inositol proceeds by direct attack of water at phosphorus. However, research groups have independently proposed either an in-line displacement (with inversion of stereochemistry at phosphorus) or an adjacent attack with a pseudorotation (with retention of stereochemistry at phosphorus). Here, the elucidation of the stereochemical pathway is presented. The IMPase-catalyzed hydrolysis of D-1-Sp-myo-inositol [17O]-thiophosphate in the presence of H218O gave inorganic Rp-[16O, 17O, 18O]-thiophosphate, with inversion of configuration at phosphorus. This is only consistent with an in-line displacement, and it rules out the controversial adjacent/pseudorotation mechanism. This result will assist in the design of alternative inhibitors of IMPase.",,9,0,,undefined,,papers by authors,0.0,2002-03-01
75,2-s2.0-0036152769,10.1016/S0968-0896(01)00309-1,S0968089601003091,11814838,Synthesis and enzymatic evaluation of pyridinium-substituted uracil derivatives as novel inhibitors of thymidine phosphorylase,ar,Article,Murray P.E.,60003771,The University of Manchester,Manchester,United Kingdom,7,"['Murray, Paul E.', 'McNally, Virginia A.', 'Lockyer, Stacey D.', 'Williams, Kaye J.', 'Stratford, Ian J.', 'Jaffar, Mohammed', 'Freeman, Sally']","['8757716700', '55879115200', '6602478707', '35412265700', '7004547474', '7006611420', '16143095900']",60003771;60003771;60003771;60003771;60003771;60003771;60003771,2002-02-11,2002,Bioorganic and Medicinal Chemistry,09680896,25786,,Journal,10,3,,525-530,"A series of water soluble N(1)- and C(6)-substituted uracil pyridinium compounds were prepared as potential inhibitors of thymidine phosphorylase (TP). The C(6)-uracil substituted derivatives were the most active. 1-[(5-Chloro-2,4-dihydroxypyrimidin-6-yl)methyl]pyridinium chloride, was identified as the best inhibitor being 5-fold more potent than the known inhibitor, 6-amino-5-bromouracil. © 2002 Elsevier Science Ltd. All rights reserved.",,31,0,AICR,undefined,Association for International Cancer Research,papers by authors,0.5,2002-02-01
76,2-s2.0-24344496195,,,,N(1)- And 6-alkylpyridyl uracil derivatives as novel anti-angiogenic inhibitors of thymidine phosphorylase: Structure-activity in-vitro,ar,Article,Murray P.,60003771,The University of Manchester,Manchester,United Kingdom,5,"['Murray, P. E.', 'Lockyer, S. D.', 'Stratford, I. J.', 'Jaffar, M.', 'Freeman, S.']","['8757716700', '6602478707', '7004547474', '7006611420', '16143095900']",60003771;60003771;60003771;60003771;60003771,2000-12-01,2000,Journal of Pharmacy and Pharmacology,00223573,23102,,Journal,52,9 SUPPL.,,218,,,0,0,,undefined,,papers by authors,0.0,2000-12-01
77,2-s2.0-0034065514,10.1002/(SICI)1521-4028(200002)40:1<3::AID-JOBM3>3.0.CO;2-L,,10746194,Influence of cranberry juice on attachment of Escherichia coli to glass,ar,Article,Allison D.,60003771,The University of Manchester,Manchester,United Kingdom,4,"['Allison, D. G.', 'Cronin, M. A.', 'Hawker, J.', 'Freeman, S.']","['7202902237', '21736453900', '57197621335', '16143095900']",60003771;60003771;60003771;60003771,2000-04-05,2000,Journal of Basic Microbiology,0233111X,20221,,Journal,40,1,,3-6,An extract from fresh cranberries was shown to decrease the strength of attachment of Escherichia coli to glass coverslips when incubated together for 2 h. Pre-conditioning of the surface prior to biofilm formation also significantly weakened the strength of attached cells.,,20,0,,undefined,,papers by authors,0.0,2000-04-01
78,2-s2.0-0033504249,,,10766296,"A similarity model for the human angiogenic factor, thymidine phosphorylase/platelet derived-endothelial cell growth factor",ar,Article,Cole C.,60003771,The University of Manchester,Manchester,United Kingdom,6,"['Cole, Christian', 'Marks, Deborah S.', 'Jaffar, Mohammed', 'Stratford, Ian J.', 'Douglas, Kenneth T.', 'Freeman, Sally']","['7202468472', '7202504969', '7006611420', '7004547474', '7101692635', '16143095900']",60003771;60003771;60003771;60003771;60003771;60003771,1999-10-01,October 1999,Anti-Cancer Drug Design,02669536,37409,,Journal,14,5,,411-420,"Thymidine phosphorylase (EC 2.4.2.4), identical to the angiogenic factor, platelet-derived endothelial cell growth factor (PD-ECGF), is up-regulated in several tumour types. A similarity model of human thymidine phosphorylase was built, based on the crystal structure of the Escherichia coli enzyme. The high residue conservation between the two enzyme sources (39% sequence identity and 53% sequence similarity) aided model building. The human model was very similar to the E. coli enzyme's crystal structure, with the main tertiary structure difference being the destruction of helix 15 in E. coli by the presence of a loop in the human model. The model was used to rationalize the nature of the binding of the substrates thymine and thymidine, and of known inhibitors using a quantitative docking algorithm. Ab initio calculations on the nM inhibitor 5-chloro-6-(1-(2-iminopyrrolidinyl)methyl)uracil hydrochloride gave its conformation and distribution of charge. Subsequent quantitative docking studies have led to the suggestion, for the first time, that this inhibitor behaves as an oxycarbenium ion transition-state analogue, explaining its strong reported inhibition.",Angiogenesis | Docking | Inhibitors | Oxycarbenium ion | PD-ECGF | Similarity modelling | Thymidine phosphorylase,16,0,,undefined,,papers by authors,0.0,1999-10-01
79,2-s2.0-0033237396,,,10766293,The role of thymidine phosphorylase/PD-ECGF in cancer chemotherapy: A chemical perspective,re,Review,Cole C.,60003771,The University of Manchester,Manchester,United Kingdom,6,"['Cole, Christian', 'Foster, Alison J.', 'Freeman, Sally', 'Jaffar, Mohammed', 'Murray, Paul E.', 'Stratford, Ian J.']","['7202468472', '57198019085', '16143095900', '7006611420', '8757716700', '7004547474']",60003771;60003771;60003771;60003771;60003771;60003771,1999-10-01,October 1999,Anti-Cancer Drug Design,02669536,37409,,Journal,14,5,,383-392,The angiogenic growth factor thymidine phosphorylase/PD-ECGF has been identified as a potential target in the development of anti-cancer drugs. This review firstly discusses the biological role of TP/PD-ECGF and its importance in the activation of 5-fluorouracil and its prodrugs. The chemistry and chemotherapeutic potential of TP/PD-ECGF inhibitors are also discussed.,5-fluorouracil | Angiogenesis | Anti-cancer drugs | PD-ECGF | Thymidine phosphorylase | TP inhibitors,28,0,,undefined,,papers by authors,0.5,1999-10-01
80,2-s2.0-0033568631,10.1021/ja991939r,,,Inversion of configuration during the hydrolysis of D-1-S(p)-myo- inositol [<sup>17</sup>O]thiophosphate catalyzed by myo-inositol monophosphatase,ar,Article,Fauroux C.,60033125;60025225;60003771,University of Leicester;University of Southampton;The University of Manchester,Leicester;Southampton;Manchester,United Kingdom;United Kingdom;United Kingdom,6,"['Fauroux, Christine M.J.', 'Lee, Michael', 'Cullis, Paul M.', 'Douglas, Kenneth T.', 'Freeman, Sally', 'Gore, Michael G.']","['6507753070', '7409118844', '7101856305', '7101692635', '16143095900', '57203612453']",60003771;60033125;60033125;60003771;60003771;60025225,1999-09-15,15 September 1999,Journal of the American Chemical Society,00027863,22680,,Journal,121,36,,8385-8386,,,10,0,,undefined,,papers by authors,0.0,1999-09-01
